{
  "$schema": "https://json-schema.org/draft/2020-12/schema",
  "$id": "scenario.schema.json",
  "title": "Scenario",
  "description": "An engine-neutral test: a map, a start, a timeline of inputs, and expectations. Times are in seconds and convert to ticks as described in scenarios/README.md.",
  "type": "object",
  "properties": {
    "$schema": { "type": "string" },
    "description": { "description": "What the scenario shows, in a sentence or two.", "type": "string" },
    "status": {
      "description": "unverified: written without an engine run; expectations may be tuned once on first run. verified: an engine has passed it; expectations change only for intentional behavior changes.",
      "enum": ["unverified", "verified"]
    },
    "map": { "description": "Map name, as in example/maps/<name>.map.", "type": "string", "pattern": "^[a-z0-9_]+$" },
    "seed": { "description": "Seed for the sim's RNG. Defaults to 0.", "type": "integer", "minimum": 0 },
    "duration": { "description": "Total time to simulate, in seconds.", "type": "number", "exclusiveMinimum": 0, "maximum": 600 },
    "start": {
      "description": "The player spawns at the marker's origin raised by 1 unit, at rest, holding the starting weapon ready to fire; the first tick settles it onto the floor.",
      "type": "object",
      "properties": {
        "marker": { "description": "Name of an info_marker in the map.", "type": "string" },
        "yaw": { "description": "Facing in degrees; 0 is east (+x), 90 is north (+y).", "type": "number", "minimum": 0, "exclusiveMaximum": 360 },
        "pitch": { "description": "Pitch in degrees; positive looks up. Defaults to 0.", "type": "number", "minimum": -90, "maximum": 90 }
      },
      "required": ["marker", "yaw"],
      "additionalProperties": false
    },
    "map_enemies": {
      "description": "Spawn the map's own enemies too, before any listed in enemies. Defaults to false, so scenarios have only the enemies they list.",
      "type": "boolean"
    },
    "enemies": {
      "description": "Enemies placed for this scenario, spawned after the map's (if any), in order. Each is dropped onto the floor below where it's placed, as map enemies are.",
      "type": "array",
      "items": { "$ref": "#/$defs/enemy_spawn" }
    },
    "inputs": {
      "description": "Consecutive segments. Each holds one set of inputs from the previous segment's end (or 0) until its own 'until'. After the last segment, inputs are neutral with the view held.",
      "type": "array",
      "minItems": 1,
      "items": { "$ref": "#/$defs/segment" }
    },
    "expect": {
      "description": "Checks on the player's and enemies' state at given times.",
      "type": "array",
      "minItems": 1,
      "items": { "$ref": "#/$defs/expectation" }
    }
  },
  "required": ["description", "status", "map", "duration", "start", "inputs", "expect"],
  "additionalProperties": false,
  "$defs": {
    "enemy_spawn": {
      "description": "One enemy, placed at a marker or a position (exactly one of the two).",
      "type": "object",
      "properties": {
        "type": { "description": "Enemy id in example/data/enemies.json.", "type": "string" },
        "marker": { "description": "Name of an info_marker in the map.", "type": "string" },
        "position": { "description": "Where to place it, in map coordinates.", "type": "array", "items": { "type": "number" }, "minItems": 3, "maxItems": 3 },
        "yaw": { "description": "Facing in degrees; 0 is east (+x), 90 is north (+y).", "type": "number", "minimum": 0, "exclusiveMaximum": 360 }
      },
      "required": ["type", "yaw"],
      "additionalProperties": false
    },
    "segment": {
      "type": "object",
      "properties": {
        "until": { "description": "End time of this segment in seconds; must increase from segment to segment.", "type": "number", "exclusiveMinimum": 0 },
        "yaw": { "description": "View yaw in degrees. Carries over from the previous segment (or the start) when omitted.", "type": "number", "minimum": 0, "exclusiveMaximum": 360 },
        "pitch": { "description": "View pitch in degrees, positive up. Carries over when omitted.", "type": "number", "minimum": -90, "maximum": 90 },
        "forward": { "$ref": "input_command.schema.json#/properties/forward" },
        "side": { "$ref": "input_command.schema.json#/properties/side" },
        "jump": { "description": "Hold jump. Defaults to false in each segment.", "type": "boolean" },
        "attack": { "description": "Hold attack. Defaults to false in each segment.", "type": "boolean" },
        "weapon": { "$ref": "input_command.schema.json#/properties/weapon" }
      },
      "required": ["until"],
      "additionalProperties": false
    },
    "expectation": {
      "type": "object",
      "properties": {
        "at": { "description": "Time in seconds at which to check.", "type": "number", "minimum": 0 },
        "note": { "description": "Why this check matters, for whoever reads a failure.", "type": "string" },
        "position": { "description": "Expected player origin; null skips an axis. Needs a tolerance.", "$ref": "#/$defs/vec3_or_null" },
        "velocity": { "description": "Expected velocity in units per second; null skips an axis. Needs a tolerance.", "$ref": "#/$defs/vec3_or_null" },
        "tolerance": { "description": "Allowed difference per checked axis of position, velocity, and last_hit.", "type": "number", "minimum": 0 },
        "on_ground": { "type": "boolean" },
        "health": { "description": "The player's health (0 or less once dead).", "type": "number" },
        "near_marker": {
          "description": "The player origin is within this distance of a marker's origin.",
          "type": "object",
          "properties": {
            "name": { "type": "string" },
            "within": { "type": "number", "exclusiveMinimum": 0 }
          },
          "required": ["name", "within"],
          "additionalProperties": false
        },
        "weapon": {
          "description": "The weapon in hand, by its id in example/data/weapons.json. During a switch, the old weapon until it is fully lowered, then the new one while it raises.",
          "type": "string"
        },
        "shots": {
          "description": "How many times the player has fired since the start, through this tick (a shotgun blast is one shot).",
          "type": "integer",
          "minimum": 0
        },
        "enemy": {
          "description": "Checks on one enemy. Uses the expectation's tolerance for position.",
          "type": "object",
          "properties": {
            "index": { "description": "The enemy's place in spawn order, from 0: the map's enemies (with map_enemies), then the scenario's.", "type": "integer", "minimum": 0 },
            "mode": { "enum": ["idle", "chase", "attack", "pain", "dead"] },
            "health": { "type": "number" },
            "position": { "description": "Expected origin; null skips an axis. Needs a tolerance.", "$ref": "#/$defs/vec3_or_null" },
            "near_player": { "description": "The enemy's origin is within this distance of the player's.", "type": "number", "exclusiveMinimum": 0 }
          },
          "required": ["index"],
          "additionalProperties": false
        },
        "last_hit": {
          "description": "Where the player's most recent pellet hit a wall or an entity, through this tick (a wall hit stops 1/32 short of the surface); null skips an axis. Needs a tolerance. Fails if nothing has been hit yet.",
          "$ref": "#/$defs/vec3_or_null"
        }
      },
      "required": ["at"],
      "additionalProperties": false
    },
    "vec3_or_null": {
      "type": "array",
      "items": { "type": ["number", "null"] },
      "minItems": 3,
      "maxItems": 3
    }
  }
}
