{
  "$schema": "./schemas/scenario.schema.json",
  "description": "A shotgunner that sees the player follows them down the 18-unit step lane, stopping to shoot whenever it can, climbs the step, and closes in until one more think's worth of movement would reach them.",
  "status": "verified",
  "map": "test_movement",
  "duration": 8.0,
  "start": { "marker": "step18_start", "yaw": 0 },
  "enemies": [
    { "type": "shotgunner", "position": [-64, 144, 24], "yaw": 0 }
  ],
  "inputs": [
    { "until": 1.2, "forward": 127 },
    { "until": 8.0, "yaw": 180 }
  ],
  "expect": [
    {
      "at": 1.0,
      "note": "It saw the player on its first think, followed them east at its run speed of 110, and once its 0.6 s reaction delay was up, stopped to shoot (a 0.4 s wind-up), still on the lane floor before the step at x = 256.",
      "enemy": { "index": 0, "mode": "attack", "position": [2, 144, 24.03125] },
      "tolerance": 0.5
    },
    {
      "at": 4.0,
      "note": "It has climbed the 18-unit step: standing 18 + 24 + 1/32 above the lane floor.",
      "enemy": { "index": 0, "mode": "chase", "position": [null, 144, 42.03125] },
      "tolerance": 0.01
    },
    {
      "at": 7.0,
      "note": "The player stopped on the step near x = 495. The enemy stops when one more think's worth of movement (11 units, plus Quake's 1-unit growth on each box) would reach the player's box, about 42 units between origins.",
      "enemy": { "index": 0, "mode": "chase", "near_player": 48 }
    }
  ]
}
