{
  "$schema": "./schemas/scenario.schema.json",
  "description": "A shotgunner that sees the player over a 32-high low cover can't climb it (its step height is 18). After shooting over it, it runs into the cover, slides along its face, gets around its south end, and reaches the player. It is never inside the cover.",
  "status": "verified",
  "map": "test_combat",
  "duration": 12.0,
  "start": { "marker": "north_west", "yaw": 270 },
  "enemies": [
    { "type": "shotgunner", "position": [160, 512, 24], "yaw": 180 }
  ],
  "inputs": [
    { "until": 0.25, "forward": 127 },
    { "until": 12.0 }
  ],
  "expect": [
    {
      "at": 2.0,
      "note": "Against the cover's east face (x = 64; its box reaches 16 west of its origin, so it can get no closer than x = 80), level with the cover (y 496 to 528), sliding south along it.",
      "enemy": { "index": 0, "mode": "chase", "position": [84.91, 487.04, 24.03125] },
      "tolerance": 1
    },
    {
      "at": 11.0,
      "note": "Around the cover and across to the player, stopping about 42 units away as in enemy_chases_up_step.",
      "enemy": { "index": 0, "mode": "chase", "near_player": 48 }
    }
  ]
}
